{
  "name": "unknown_wiring_pipeline",
  "params": { "layer": "registry", "exercise": "verify" },
  "input": {
    "json": {
      "sources": [{ "id": "src", "kind": "application/source", "initial_writes": [] }],
      "sinks": [{ "id": "direct", "kind": "stream_egress" }],
      "hooks": [
        { "id": "allow", "kind": "Net", "allowed_namespaces": [], "reads": [], "writes": [], "may_terminate": true, "may_jump": false, "may_jump_to": [], "may_accept_to": [], "side_effect_only": false }
      ],
      "pipelines": [{ "id": "main", "hooks": ["allow"] }],
      "wirings": [{ "source": "src", "pipeline": "ghost" }]
    }
  },
  "expect": { "ok": false, "error_contains": "references unknown pipeline" }
}
