{
  "name": "unknown_sink_in_may_accept_to",
  "params": { "layer": "registry", "exercise": "verify" },
  "input": {
    "json": {
      "sources": [{ "id": "src", "kind": "application/source", "initial_writes": [] }],
      "sinks": [{ "id": "direct", "kind": "stream_egress" }],
      "hooks": [
        { "id": "term", "kind": "Transport", "allowed_namespaces": [], "reads": [], "writes": [], "may_terminate": true, "may_jump": false, "may_jump_to": [], "may_accept_to": ["ghost_sink"], "side_effect_only": false }
      ],
      "pipelines": [{ "id": "main", "hooks": ["term"] }],
      "wirings": [{ "source": "src", "pipeline": "main" }]
    }
  },
  "expect": { "ok": false, "error_contains": "lists unknown sink" }
}
