{
  "name": "unknown_pipeline_jump_target",
  "params": { "layer": "registry", "exercise": "verify" },
  "input": {
    "json": {
      "sources": [{ "id": "src", "kind": "application/source", "initial_writes": [] }],
      "sinks": [{ "id": "direct", "kind": "stream_egress" }],
      "hooks": [
        { "id": "jump_h", "kind": "Net", "allowed_namespaces": [], "reads": [], "writes": [], "may_terminate": false, "may_jump": true, "may_jump_to": ["nowhere"], "may_accept_to": [], "side_effect_only": false }
      ],
      "pipelines": [{ "id": "main", "hooks": ["jump_h"] }],
      "wirings": [{ "source": "src", "pipeline": "main" }]
    }
  },
  "expect": { "ok": false, "error_contains": "jumps to unknown pipeline" }
}
